{
  "schema_version": 1,
  "legacy_route": {
    "method": "PUT",
    "path": "/api/v1/instances/{instance_id}/show-pages/{page_id}/authorized-emails"
  },
  "enforcement_marker": {
    "producer": "authenticated_current_grant_result",
    "field": "legacy_write_policy",
    "enforced_value": "disabled"
  },
  "phases": [
    {
      "phase": "additive",
      "new_protocol_available": true,
      "current_grant_legacy_write_policy": "temporarily_allowed",
      "legacy_put_result": "accepted_for_released_clients",
      "new_access_schema_may_activate": false
    },
    {
      "phase": "enforced",
      "new_protocol_available": true,
      "current_grant_legacy_write_policy": "disabled",
      "legacy_put_result": "409_show_grant_protocol_required",
      "new_access_schema_may_activate": true
    },
    {
      "phase": "retired",
      "new_protocol_available": true,
      "current_grant_legacy_write_policy": "disabled",
      "legacy_put_result": "410_gone",
      "new_access_schema_may_activate": true
    }
  ]
}
